{
  "$schema": "https://json-schema.org/draft/2020-12/schema",
  "x-select": ["topic"],
  "title": "Topic",
  "description": "One topic: the commander's own statements on a single subject, each held verbatim with the transcript it came from, so the pilot can see how his thinking on that subject stands. Filed by name, altitude.json.",
  "type": "object",
  "required": ["kind", "name", "title", "scope", "updated", "statements"],
  "properties": {
    "kind": {
      "description": "the word topic, which is what chooses this schema",
      "const": "topic"
    },
    "name": {
      "description": "the topic's name in lowercase with hyphens, the same name the file is named for and the same word its manifest row carries; a unit filed by name carries name, one filed by identifier carries id",
      "type": "string",
      "pattern": "^[a-z][a-z0-9-]*$"
    },
    "title": {
      "description": "the topic in a few words, as a reader would look for it",
      "type": "string",
      "minLength": 1
    },
    "scope": {
      "description": "what belongs in this topic and what does not, in one line",
      "type": "string",
      "minLength": 1
    },
    "record": {
      "description": "the manual this topic has been distilled into, by file name; absent until one exists",
      "type": "string",
      "minLength": 1
    },
    "updated": {
      "description": "the date a statement was last added, YYYY-MM-DD",
      "type": "string",
      "pattern": "^[0-9]{4}-[0-9]{2}-[0-9]{2}$"
    },
    "statements": {
      "description": "one row per statement: where it came from, when, the commander's words, and what was happening around them",
      "type": "array",
      "items": {
        "type": "object",
        "required": ["ref", "date", "statement"],
        "properties": {
          "ref": { "description": "where the statement can be found again, as session and line, 9b679556:7004", "type": "string", "minLength": 1 },
          "date": { "description": "the day it was said, YYYY-MM-DD", "type": "string", "pattern": "^[0-9]{4}-[0-9]{2}-[0-9]{2}$" },
          "statement": { "description": "the commander's own words, verbatim and never edited", "type": "string", "minLength": 1 },
          "context": { "description": "what was happening when he said it", "type": "string", "minLength": 1 },
          "superseded_by": { "description": "the ref of the later statement that overrides this one; absent while it stands", "type": "string", "minLength": 1 }
        }
      }
    }
  }
}
